{
  "schema_version": "0.1",
  "type": "MethodControlEnrollment",
  "mission_id": "MIS-FIXTURE",
  "wave_id": "W1",
  "agent_id": "fixture-agent",
  "provider": "codex",
  "session_binding": {
    "session_id": "fixture-session",
    "provider_agent_id": "main"
  },
  "launch_slot_ref": {
    "artifact_id": "MCTL-dacbf9602d1508ab87d86fab9dfdc3c9df0d8ae8",
    "relative_path": "repositories/fixture/missions/MIS-FIXTURE/W1/controls/MCTL-dacbf9602d1508ab87d86fab9dfdc3c9df0d8ae8.json",
    "sha256": "1111111111111111111111111111111111111111111111111111111111111111"
  },
  "session_observation_ref": {
    "artifact_id": "MCTL-adddb13746420abce96b94e9a64696d74ef1cdf7",
    "relative_path": "repositories/fixture/missions/MIS-FIXTURE/W1/controls/MCTL-adddb13746420abce96b94e9a64696d74ef1cdf7.json",
    "sha256": "1111111111111111111111111111111111111111111111111111111111111111"
  },
  "plan_ref": {
    "artifact_id": "MWP-FIXTURE",
    "relative_path": "repositories/fixture/missions/MIS-FIXTURE/W1/controls/MWP-FIXTURE.json",
    "sha256": "1111111111111111111111111111111111111111111111111111111111111111"
  },
  "context_ref": {
    "artifact_id": "ACP-FIXTURE",
    "relative_path": "repositories/fixture/missions/MIS-FIXTURE/W1/controls/ACP-FIXTURE.json",
    "sha256": "1111111111111111111111111111111111111111111111111111111111111111"
  },
  "policy_ref": {
    "artifact_id": "DTP-FIXTURE",
    "relative_path": "repositories/fixture/missions/MIS-FIXTURE/W1/controls/DTP-FIXTURE.json",
    "sha256": "1111111111111111111111111111111111111111111111111111111111111111"
  },
  "lease_ref": {
    "artifact_id": "ADL-FIXTURE",
    "relative_path": "repositories/fixture/missions/MIS-FIXTURE/W1/controls/ADL-FIXTURE.json",
    "sha256": "1111111111111111111111111111111111111111111111111111111111111111"
  },
  "repository_key": "fixture",
  "repository_identity_fingerprint": "2222222222222222222222222222222222222222222222222222222222222222",
  "server_name": "cannae_method_fixture",
  "runtime_sha256": "a966e7f4bff259ff723948e27ae71b40336cf00d21c9c89e9286c32783b96644",
  "launch_descriptor_sha256": "3333333333333333333333333333333333333333333333333333333333333333",
  "credential_sha256": "4444444444444444444444444444444444444444444444444444444444444444",
  "identity_assurance": "local_operator_enrollment_reference",
  "provider_startup_verified": false,
  "recorded_at": "2026-10-22T00:00:00.000Z",
  "expires_at": "2026-10-22T00:10:00.000Z",
  "execution_authorized": false,
  "continuation_authorized": false,
  "release_authorized": false,
  "human_final_decision_authority": "USER",
  "id": "MCTL-2e78c68ff4445851c17f6772b29efeabd793d43b"
}
